<?xml version="1.0" encoding="UTF-8"?>
<dataroot xmlns:od="urn:schemas-microsoft-com:officedata" xmlns:xsi="http://www.w3.org/2001/XMLSchema-instance"  xsi:noNamespaceSchemaLocation="dbo_skill.xsd" generated="2019-04-21T01:26:21">
<dbo_skill>
<skill_id>7</skill_id>
<skill>Data Analysis</skill>
<detail_id>4</detail_id>
<category_id>15</category_id>
</dbo_skill>
<dbo_skill>
<skill_id>11</skill_id>
<skill>Circuit Implementation</skill>
<category_id>15</category_id>
</dbo_skill>
<dbo_skill>
<skill_id>12</skill_id>
<skill>Data Exploration</skill>
<category_id>15</category_id>
</dbo_skill>
<dbo_skill>
<skill_id>1885</skill_id>
<skill>Data Visualization</skill>
<category_id>15</category_id>
</dbo_skill>
<dbo_skill>
<skill_id>1886</skill_id>
<skill>Dimensionality Reduction</skill>
<category_id>15</category_id>
</dbo_skill>
<dbo_skill>
<skill_id>1887</skill_id>
<skill>Classification</skill>
<category_id>15</category_id>
</dbo_skill>
<dbo_skill>
<skill_id>1888</skill_id>
<skill>Clustering</skill>
<category_id>15</category_id>
</dbo_skill>
<dbo_skill>
<skill_id>1889</skill_id>
<skill>Regression</skill>
<category_id>15</category_id>
</dbo_skill>
<dbo_skill>
<skill_id>1890</skill_id>
<skill>Deep Learning</skill>
<category_id>15</category_id>
</dbo_skill>
<dbo_skill>
<skill_id>1891</skill_id>
<skill>Time Domain Analysis</skill>
<category_id>15</category_id>
</dbo_skill>
<dbo_skill>
<skill_id>1892</skill_id>
<skill>Filter Design</skill>
<category_id>15</category_id>
</dbo_skill>
<dbo_skill>
<skill_id>1893</skill_id>
<skill>Signal Modeling</skill>
<category_id>15</category_id>
</dbo_skill>
<dbo_skill>
<skill_id>1894</skill_id>
<skill>Source Separation</skill>
<category_id>15</category_id>
</dbo_skill>
<dbo_skill>
<skill_id>1895</skill_id>
<skill>Geometric Transforms</skill>
<category_id>15</category_id>
</dbo_skill>
<dbo_skill>
<skill_id>1896</skill_id>
<skill>Segmentation</skill>
<category_id>15</category_id>
</dbo_skill>
<dbo_skill>
<skill_id>1897</skill_id>
<skill>Feature Extraction</skill>
<detail_id>5</detail_id>
<category_id>15</category_id>
</dbo_skill>
<dbo_skill>
<skill_id>1898</skill_id>
<skill>Freq. Domain Analysis</skill>
<category_id>15</category_id>
</dbo_skill>
<dbo_skill>
<skill_id>1899</skill_id>
<skill>Object Recognition</skill>
<category_id>15</category_id>
</dbo_skill>
<dbo_skill>
<skill_id>1900</skill_id>
<skill>Functional Programming</skill>
<category_id>15</category_id>
</dbo_skill>
<dbo_skill>
<skill_id>1901</skill_id>
<skill>Procedural Programming</skill>
<category_id>15</category_id>
</dbo_skill>
<dbo_skill>
<skill_id>1902</skill_id>
<skill>Object-Oriented Programming</skill>
<category_id>15</category_id>
</dbo_skill>
<dbo_skill>
<skill_id>1903</skill_id>
<skill>Unit Test</skill>
<category_id>15</category_id>
</dbo_skill>
<dbo_skill>
<skill_id>1904</skill_id>
<skill>UI Design</skill>
<category_id>15</category_id>
</dbo_skill>
<dbo_skill>
<skill_id>1905</skill_id>
<skill>Analog Circuit Design</skill>
<category_id>15</category_id>
</dbo_skill>
<dbo_skill>
<skill_id>1906</skill_id>
<skill>Logic Circuit Design</skill>
<category_id>15</category_id>
</dbo_skill>
<dbo_skill>
<skill_id>1907</skill_id>
<skill>Communication Circuit Design</skill>
<category_id>15</category_id>
</dbo_skill>
<dbo_skill>
<skill_id>1908</skill_id>
<skill>Waveguide Design</skill>
<category_id>15</category_id>
</dbo_skill>
<dbo_skill>
<skill_id>1909</skill_id>
<skill>Microstrip Design</skill>
<category_id>15</category_id>
</dbo_skill>
<dbo_skill>
<skill_id>1910</skill_id>
<skill>Feedback Control Design</skill>
<category_id>15</category_id>
</dbo_skill>
<dbo_skill>
<skill_id>1911</skill_id>
<skill>Freq. Response Analysis</skill>
<category_id>15</category_id>
</dbo_skill>
<dbo_skill>
<skill_id>1912</skill_id>
<skill>Robustness Analysis</skill>
<category_id>15</category_id>
</dbo_skill>
<dbo_skill>
<skill_id>1913</skill_id>
<skill>Noise Modeling</skill>
<category_id>15</category_id>
</dbo_skill>
<dbo_skill>
<skill_id>1914</skill_id>
<skill>Feature Selection</skill>
<category_id>15</category_id>
</dbo_skill>
<dbo_skill>
<skill_id>1915</skill_id>
<skill>Object Tracking</skill>
<category_id>15</category_id>
</dbo_skill>
<dbo_skill>
<skill_id>1916</skill_id>
<skill>Analog Circuit Implementation</skill>
<category_id>15</category_id>
</dbo_skill>
<dbo_skill>
<skill_id>1917</skill_id>
<skill>Thresholding</skill>
<category_id>15</category_id>
</dbo_skill>
<dbo_skill>
<skill_id>1918</skill_id>
<skill>Point Cloud Registration</skill>
<category_id>15</category_id>
</dbo_skill>
<dbo_skill>
<skill_id>1923</skill_id>
<skill>Depth Perception</skill>
<category_id>15</category_id>
</dbo_skill>
<dbo_skill>
<skill_id>1936</skill_id>
<skill>Spatial Filters</skill>
<category_id>15</category_id>
</dbo_skill>
<dbo_skill>
<skill_id>1938</skill_id>
<skill>Image Transforms</skill>
<category_id>15</category_id>
</dbo_skill>
<dbo_skill>
<skill_id>1940</skill_id>
<skill>Database Design</skill>
<category_id>15</category_id>
</dbo_skill>
<dbo_skill>
<skill_id>1941</skill_id>
<skill>Data Manipulation</skill>
<category_id>15</category_id>
</dbo_skill>
<dbo_skill>
<skill_id>1942</skill_id>
<skill>Data Conversion</skill>
<category_id>15</category_id>
</dbo_skill>
<dbo_skill>
<skill_id>1943</skill_id>
<skill>Data Migration</skill>
<category_id>15</category_id>
</dbo_skill>
<dbo_skill>
<skill_id>1944</skill_id>
<skill>End-user Programming</skill>
<category_id>15</category_id>
</dbo_skill>
<dbo_skill>
<skill_id>1946</skill_id>
<skill>Version Control</skill>
<category_id>15</category_id>
</dbo_skill>
<dbo_skill>
<skill_id>1948</skill_id>
<skill>Signal Transform</skill>
<category_id>15</category_id>
</dbo_skill>
<dbo_skill>
<skill_id>1950</skill_id>
<skill>Model Evaluation</skill>
<category_id>15</category_id>
</dbo_skill>
<dbo_skill>
<skill_id>1951</skill_id>
<skill>System Visualization</skill>
<category_id>15</category_id>
</dbo_skill>
<dbo_skill>
<skill_id>1952</skill_id>
<skill>Signal Visualization</skill>
<category_id>15</category_id>
</dbo_skill>
<dbo_skill>
<skill_id>1953</skill_id>
<skill>Business Intelligence</skill>
<category_id>15</category_id>
</dbo_skill>
<dbo_skill>
<skill_id>1954</skill_id>
<skill>Web Development</skill>
<category_id>15</category_id>
</dbo_skill>
<dbo_skill>
<skill_id>1955</skill_id>
<skill>Signal Processing</skill>
<category_id>15</category_id>
</dbo_skill>
<dbo_skill>
<skill_id>1956</skill_id>
<skill>Image Processing</skill>
<category_id>15</category_id>
</dbo_skill>
<dbo_skill>
<skill_id>1957</skill_id>
<skill>Pattern Recognition</skill>
<category_id>15</category_id>
</dbo_skill>
<dbo_skill>
<skill_id>1958</skill_id>
<skill>Data Science</skill>
<category_id>15</category_id>
</dbo_skill>
<dbo_skill>
<skill_id>1959</skill_id>
<skill>Computer Vision</skill>
<category_id>15</category_id>
</dbo_skill>
<dbo_skill>
<skill_id>1960</skill_id>
<skill>Machine Vision</skill>
<category_id>15</category_id>
</dbo_skill>
<dbo_skill>
<skill_id>1961</skill_id>
<skill>Machine Learning</skill>
<category_id>15</category_id>
</dbo_skill>
<dbo_skill>
<skill_id>1962</skill_id>
<skill>Software Engineering</skill>
<category_id>15</category_id>
</dbo_skill>
<dbo_skill>
<skill_id>1963</skill_id>
<skill>Control System Design</skill>
<category_id>15</category_id>
</dbo_skill>
<dbo_skill>
<skill_id>1964</skill_id>
<skill>Antenna Design</skill>
<category_id>15</category_id>
</dbo_skill>
<dbo_skill>
<skill_id>1965</skill_id>
<skill>Circuit Design</skill>
<category_id>15</category_id>
</dbo_skill>
<dbo_skill>
<skill_id>1966</skill_id>
<skill>Microwave Design</skill>
<category_id>15</category_id>
</dbo_skill>
<dbo_skill>
<skill_id>1967</skill_id>
<skill>Electronics</skill>
<category_id>15</category_id>
</dbo_skill>
<dbo_skill>
<skill_id>1969</skill_id>
<skill>Optimization</skill>
<category_id>15</category_id>
</dbo_skill>
<dbo_skill>
<skill_id>1970</skill_id>
<skill>SIFT</skill>
<category_id>13</category_id>
</dbo_skill>
<dbo_skill>
<skill_id>1971</skill_id>
<skill>SURF</skill>
<category_id>13</category_id>
</dbo_skill>
<dbo_skill>
<skill_id>1972</skill_id>
<skill>HOG</skill>
<category_id>13</category_id>
</dbo_skill>
<dbo_skill>
<skill_id>1973</skill_id>
<skill>LoG</skill>
<category_id>13</category_id>
</dbo_skill>
<dbo_skill>
<skill_id>1974</skill_id>
<skill>Hough Transform</skill>
<category_id>13</category_id>
</dbo_skill>
<dbo_skill>
<skill_id>1975</skill_id>
<skill>Connected Component Analysis</skill>
<category_id>13</category_id>
</dbo_skill>
<dbo_skill>
<skill_id>1976</skill_id>
<skill>Watershed</skill>
<category_id>13</category_id>
</dbo_skill>
<dbo_skill>
<skill_id>1977</skill_id>
<skill>SVM</skill>
<category_id>13</category_id>
</dbo_skill>
<dbo_skill>
<skill_id>1978</skill_id>
<skill>Artificial Neural Network (ANN)</skill>
<category_id>13</category_id>
</dbo_skill>
<dbo_skill>
<skill_id>1979</skill_id>
<skill>Na√Øve Bayes</skill>
<category_id>13</category_id>
</dbo_skill>
<dbo_skill>
<skill_id>1980</skill_id>
<skill>Decision Tree</skill>
<category_id>13</category_id>
</dbo_skill>
<dbo_skill>
<skill_id>1981</skill_id>
<skill>Random Forest</skill>
<category_id>13</category_id>
</dbo_skill>
<dbo_skill>
<skill_id>1982</skill_id>
<skill>k-Means</skill>
<category_id>13</category_id>
</dbo_skill>
<dbo_skill>
<skill_id>1983</skill_id>
<skill>Fuzzy C-means</skill>
<category_id>13</category_id>
</dbo_skill>
<dbo_skill>
<skill_id>1984</skill_id>
<skill>PCA</skill>
<category_id>13</category_id>
</dbo_skill>
<dbo_skill>
<skill_id>1985</skill_id>
<skill>ICA</skill>
<category_id>13</category_id>
</dbo_skill>
<dbo_skill>
<skill_id>1986</skill_id>
<skill>Python</skill>
<category_id>12</category_id>
</dbo_skill>
<dbo_skill>
<skill_id>1987</skill_id>
<skill>MATLAB</skill>
<category_id>12</category_id>
</dbo_skill>
<dbo_skill>
<skill_id>1988</skill_id>
<skill>C/C++</skill>
<category_id>12</category_id>
</dbo_skill>
<dbo_skill>
<skill_id>1989</skill_id>
<skill>JavaScript</skill>
<category_id>12</category_id>
</dbo_skill>
<dbo_skill>
<skill_id>1990</skill_id>